"datetime","lon","lat","place_name","event_type","headline"
"2024-11-08 00:00:00","37.35901","47.88455","Antonivka","firefighb|loc","На Курахівському напрямку вчора відбулися бої біля Іллінки, Кремінної Балки, Новоселидівки, Новодмитрівки, Максимілянівки, Антонівки та Катеринівки, - повідомляє Генштаб ЗСУ"
"2024-11-08 00:00:00","38.221114","49.049943","Kreminna","firefighb|loc","На Курахівському напрямку вчора відбулися бої біля Іллінки, Кремінної Балки, Новоселидівки, Новодмитрівки, Максимілянівки, Антонівки та Катеринівки, - повідомляє Генштаб ЗСУ"
"2024-11-08 00:00:00","37.21084","48.13247","Novooleksiivka","loc","На Покровському напрямку бойові дії вчора відбулися поблизу Миролюбівки, Проміні, Новогродівки, Крутого Яру, Селидового, Лисівки та Новоолексіївки, - повідомляє Генштаб ЗСУ"
"2024-11-08 00:00:00","33.847145","47.835445","Novooleksiivka","loc","На Покровському напрямку бойові дії вчора відбулися поблизу Миролюбівки, Проміні, Новогродівки, Крутого Яру, Селидового, Лисівки та Новоолексіївки, - повідомляє Генштаб ЗСУ"
"2024-11-08 00:00:00","37.10541","47.9045","Maksymivka","raid|loc","На Времівському напрямку вчора відбулися зіткнення біля Трудового та Максимівки, - повідомляє Генштаб ЗСУ"
"2024-11-08 00:00:00","37.8031","48.38087","Leonidivka","loc","На Торецькому напрямку бойові дії вчора відбулися біля Торецька, Диліївки та Щербинівки, - повідомляє Генштаб ЗСУ"
"2024-11-08 00:00:00","24.029898","49.839323","Lviv","loc","У Львові після куріння вейпу госпіталізували 14-річну дівчину: для неї це вже вдруге за рік."
"2024-11-08 00:57:00","34.0994127132379","44.9536335","Simferopol","","МЗС висловило протест у зв'язку з участю представників окупаційної адміністрації в Криму в 12-й сесії WUF12"
"2024-11-08 01:17:00","30.731689","46.484213","Odessa","uav|milcas|loc","Російські БпЛА вночі атакували Одеський район, попередньо, двоє поранених"
"2024-11-08 01:47:00","30.731689","46.484213","Odessa","airstrike|uav|civcas|loc","Росія атакувала Одещину дронами: є постраждалі, пошкоджено одну з найстаріших шкіл Одеси"
"2024-11-08 01:47:00","30.405789","46.908223","Bilka","airstrike|uav|civcas|loc","Росія атакувала Одещину дронами: є постраждалі, пошкоджено одну з найстаріших шкіл Одеси"
"2024-11-08 02:52:00","37.675289","47.955082","Ruttschenkowo","arresb|loc","Росія захопила Новоолексіївку на Донеччині"
"2024-11-08 03:30:00","30.52355","50.450441","Kyiv","","""На жодні компроміси ми не підемо"": експерт розповів про майбутні взаємини Києва з Трампом"
"2024-11-08 04:47:00","35.138851","47.838312","Zaporizhzhya","loc","У російській армії розпочались ""інспекції"" на Запоріжжі"
"2024-11-08 04:51:00","36.231202","49.992167","Kharkiv","airstrike|property|loc","Унаслідок ворожого авіаудару пошкоджено житлову багатоповерхівку в Харкові, під завалами люди - Терехов"
"2024-11-08 04:53:00","36.231202","49.992167","Kharkiv","civcas|loc","Серед постраждалих у Харкові 3-місячна дитина - Синєгубов"
"2024-11-08 05:12:00","36.231202","49.992167","Kharkiv","airstrike|civcas|loc","У Харкові 18 постраждалих, п'ятеро з них госпіталізовані - Синєгубов"
"2024-11-08 05:40:00","36.231202","49.992167","Kharkiv","civcas|loc","У Харкові вже 22 постраждалих - начальник ОВА"
"2024-11-08 05:51:00","36.231202","49.992167","Kharkiv","civcas|loc","Кількість постраждалих у Харкові зросла до 24 - Синєгубов"
"2024-11-08 06:38:00","34.0994127132379","44.9536335","Simferopol","","Окупаційну владу Криму пустили на організований за участі ООН Всесвітній форум міст, Україна заявила протест"
"2024-11-08 07:03:00","36.231202","49.992167","Kharkiv","property|loc","Росія вдарила КАБом по багатоповерхівці у Харкові: є руйнування та постраждалі"
"2024-11-08 07:09:00","24.029898","49.839323","Lviv","loc","Життя після смерті. Репортаж з Марсового поля у Львові"
"2024-11-08 07:15:00","35.138851","47.838312","Zaporizhzhya","airstrike|civcas|loc","До восьми зросла кількість загиблих через авіаудар по Запоріжжю, серед них і однорічний хлопчик - ОВА"
"2024-11-08 07:16:00","36.231202","49.992167","Kharkiv","airstrike|loc","Росія скинула на Харків 500-кілограмові бомби: в ОДА заявили про десятки поранених (фото, відео)"
"2024-11-08 07:34:00","30.731689","46.484213","Odessa","uav|civcas|loc","В Одеській області загинула одна людина, ще дев’ятеро постраждали внаслідок атаки БПЛА"
"2024-11-08 07:46:00","30.5271622858608","50.4485578","Kyiv","uav|loc","У Київській області поранено чотири людини внаслідок атаки БПЛА"
"2024-11-08 08:05:00","30.52355","50.450441","Kyiv","loc","Перед вихідними до Києва натягне хмари і стане прохолодніше"
"2024-11-08 08:16:00","32.614962","46.640319","Kherson","artillery|civcas|loc","У Херсонській області одна людина загинула, ще троє дістали поранення внаслідок обстрілів"
"2024-11-08 08:21:00","37.675289","47.955082","Ruttschenkowo","civcas|loc","Минулої доби росіяни вбили 2 жителів Донеччини, ще 6 поранили"
"2024-11-08 08:53:00","30.405789","46.908223","Bilka","loc","Російські окупанти масовано атакували Одещину: є загиблий та багато поранених"
"2024-11-08 09:32:00","35.138851","47.838312","Zaporizhzhya","airstrike|loc","До дев’яти зросла кількість загиблих через авіаудар по Запоріжжю - ОВА"
"2024-11-08 09:46:00","30.476622","50.023928","Deremezna","uav|artillery|aad|loc","Повітряні сили вночі збили чотири ракети та 62 безпілотники, на Київщині є постраждалі"
"2024-11-08 10:00:00","30.52355","50.450441","Kyiv","","Підтримка фінансової грамотності та розвиток бізнесу: в Києві провели круглий стіл за участю ветеранів і представників фінсектору"
"2024-11-08 10:00:00","30.52355","50.450441","Kyiv","","Київ намагається побачити справжній план Трампа щодо України та як новообраний президент США має підштовхнути Європу до самостійності. Акценти світових ЗМІ 8 листопада"
"2024-11-08 10:12:00","30.405789","46.908223","Bilka","uav|artillery|aad|loc","РФ атакувала Україну ракетами та дронами: на Одещині загинула людина, є поранені, на Київщині спрацювала ППО"
"2024-11-08 10:12:00","30.476622","50.023928","Deremezna","uav|artillery|aad|loc","РФ атакувала Україну ракетами та дронами: на Одещині загинула людина, є поранені, на Київщині спрацювала ППО"
"2024-11-08 10:29:00","24.173188","50.723817","Novovolynsk","arresb|loc","СБУ затримала ""крота"" російської розвідки в ТЦК на Волині"
"2024-11-08 10:35:00","35.138851","47.838312","Zaporizhzhya","airstrike|loc","П'ятеро постраждалих від авіаудару по Запоріжжю у важкому стані - влада"
"2024-11-08 10:37:00","24.173188","50.723817","Novovolynsk","arresb|loc","У ТЦК на Волині виявили російського агента, який готував повітряні удари по регіону"
"2024-11-08 10:52:00","31.993813","46.975574","Mykolayiv","civcas|loc","Волонтери УЧХ допомагали постраждалим у Запоріжжі та Миколаївці"
"2024-11-08 10:52:00","35.138851","47.838312","Zaporizhzhya","civcas|loc","Волонтери УЧХ допомагали постраждалим у Запоріжжі та Миколаївці"
"2024-11-08 11:23:00","30.52355","50.450441","Kyiv","","Все б посипалось: Кулеба пояснив, чому Зеленський на початку війни не виїхав з Києва"
"2024-11-08 11:32:00","30.405789","46.908223","Bilka","loc","ГУРівське: на Одещині назвали село на честь Воєнної розвідки України"
"2024-11-08 11:37:00","24.173188","50.723817","Novovolynsk","","Зливав секретні дані: на Волині піймали працівника ТЦК, який працював на розвідку РФ"
"2024-11-08 12:06:00","37.675289","47.955082","Ruttschenkowo","control|loc","Слов'янськ неможливо взяти з одного боку: експерт вказав на плани РФ на Донеччині"
"2024-11-08 12:06:00","37.6058241","48.8522691","Sloviansk","control|loc","Слов'янськ неможливо взяти з одного боку: експерт вказав на плани РФ на Донеччині"
"2024-11-08 13:07:00","35.138851","47.838312","Zaporizhzhya","civcas|loc","Кількість загиблих у Запоріжжі зросла до 10 осіб - ДСНС"
"2024-11-08 13:14:00","35.138851","47.838312","Zaporizhzhya","artillery|civcas|loc","Масований удар РФ по Запоріжжю: кількість загиблих зросла до 10, у місті оголошено День жалоби"
"2024-11-08 13:21:00","32.614962","46.640319","Kherson","artillery|civcas|loc","У Херсоні через обстріл загинув місцевий житель"
"2024-11-08 13:55:00","30.485497","50.58293","Vyshhorod","ied|loc","У Вишгородському районі ліквідовують вибухонебезпечні предмети"
"2024-11-08 14:03:00","30.405789","46.908223","Bilka","loc","На Одещині село Першотравневе перейменували на честь ГУР"
"2024-11-08 14:27:00","30.264853","50.580265","Hostomel","civcas|loc","В Україні судитимуть командира управління Росгвардії по Красноярському краю за розстріл мирних жителів Гостомеля"
"2024-11-08 14:33:00","36.231202","49.992167","Kharkiv","property|loc","Росія вдарила КАБами по Харкову: є руйнування та постраждалі. Фото"
"2024-11-08 14:42:00","30.52355","50.450441","Kyiv","","Трамп дав зрозуміти, що вимагатиме поступок і від Києва, і від Москви, - Bloomberg"
"2024-11-08 15:04:00","30.52355","50.450441","Kyiv","uav|civcas|loc","Нічна атака РФ: у Києві є постраждалі, в Одесі пошкоджено одну з найстаріших шкіл"
"2024-11-08 15:04:00","30.731689","46.484213","Odessa","uav|civcas|loc","Нічна атака РФ: у Києві є постраждалі, в Одесі пошкоджено одну з найстаріших шкіл"
"2024-11-08 15:12:00","37.80285","48.015884","Donetsk","loc","Ворог просувається до 2 км у день: майор запасу НГУ Гетьман про Донецький напрямок"
"2024-11-08 15:32:00","30.52355","50.450441","Kyiv","uav|loc","У Києві 7 листопада ворожий БПЛА влучив у багатоповерхівку, де живе пані посол Естонії"
"2024-11-08 15:35:00","36.505117","49.61494","Slobozhans’ke","arresb|loc","Колаборант із Харківщини отримав 11 років в'язниці - СБУ"
"2024-11-08 15:43:00","33.481729","46.55783","Chorna Dolyna","airstrike|uav|ied|civcas|loc","На Херсонщині через скидання вибухівки з дрона загинув місцевий житель"
"2024-11-08 15:48:00","32.722006","46.626143","Oleshky","arresb","Незвичайна спецоперація: в окупованих Олешках ""врубили"" гімн України (відео)"
"2024-11-08 16:33:00","34.0994127132379","44.9536335","Simferopol","","ООН встрягла в новий скандал з Росією: цього разу через Крим"
"2024-11-08 16:34:00","31.298652","51.491007","Chernihiv","loc","""Епіцентр"" відкриває відновлений торговий центр у Чернігові"
"2024-11-08 17:03:00","30.504631","50.473602","Podil","","Нардеп Шевченко закликав Зеленського до ""початку діалогу"". В ОП кажуть, що деякі депутати заплутались у питаннях інтересів України"
"2024-11-08 17:19:00","32.2656283","48.5105805","Kropyvnytskyy","arresb|loc","На Кіровоградщині затримали голову МСЕК, яка вимагала від пораненого військового $2 тис. хабаря"
"2024-11-08 17:30:00","36.231202","49.992167","Kharkiv","airstrike|loc","Волонтери УЧХ ліквідують наслідки авіаудару РФ по Харкову"
"2024-11-08 17:31:00","30.52355","50.450441","Kyiv","loc","До суду скеровано справу проти нардепа Ісаєнка за спробу заволодіти ділянкою землі в Києві"
"2024-11-08 17:35:00","35.046181","48.464717","Dnipro","artillery","""ДТЕК"" відновив електропостачання 90 тис. жителів після обстрілів у Дніпропетровській області"
"2024-11-08 17:38:00","32.2656283","48.5105805","Kropyvnytskyy","arresb|loc","На Кіровоградщині затримано голову районної МСЕК, яка вимагала $2 тис. у паралізованого військового"
"2024-11-08 18:09:00","32.614962","46.640319","Kherson","artillery|civcas|loc","У Херсоні та області внаслідок ворожих обстрілів загинули 3 людини"
"2024-11-08 18:10:00","34.123755","51.106236","Voronyne","property|loc","Ворог завдав удару по критичній інфраструктурі Сумщини - ОВА"
"2024-11-08 18:33:00","36.936802","50.294007","Vovchansk","uav|artillery|civcas|loc","Унаслідок ворожого обстрілу Вовчанська поранено волонтера - прокуратура"
"2024-11-08 18:55:00","35.046181","48.464717","Dnipro","loc","РФ атакувала два райони Дніпропетровщини: поранено жінку"
"2024-11-08 19:03:00","35.046181","48.464717","Dnipro","airstrike|loc","Росіяни атакували два райони Дніпропетровщини, постраждала жінка"
"2024-11-08 20:00:00","30.504631","50.473602","Podil","","В ГУР розкрили, чи працює у них скандальний нардеп Шевченко"
"2024-11-08 20:02:00","23.413124","48.220758","Posich","loc","Закарпатську обладміністрацію очолив Білецький, Волинську - Рудницький"
"2024-11-08 20:20:00","34.394812","47.567463","Nikopol","loc","Президент звільнив голову Нікопольської РДА Євтушенка у зв'язку зі скасуванням доступу до держтаємниці"
"2024-11-08 20:36:00","31.993813","46.975574","Mykolayiv","ied|loc","Вибух був за межами Миколаєва - мер"
"2024-11-08 20:38:00","37.834354","48.587665","Levanivskoho","uav|raid|loc","""Завдати максимальної шкоди"": наслідки атаки РФ, активізація на Курщині і наступ біля Часового Яру. Колонка Сергія Згурця"
"2024-11-08 20:50:00","35.138851","47.838312","Zaporizhzhya","civcas|loc","У Запоріжжі з-під завалів дістали тіло 10-ї жертви удару росіян 7 листопада, – ОВА"
"2024-11-08 21:39:00","34.123755","51.106236","Voronyne","airstrike|loc","Ворог завдав авіаударів по Сумщині, є значні пошкодження"
"2024-11-08 21:42:00","30.52355","50.450441","Kyiv","","Британія зупинила поставки ракет, відносини Києва і Лондона погіршилися, - The Guardian"
"2024-11-08 21:42:00","31.993813","46.975574","Mykolayiv","airstrike|loc","Ворог ударив балістикою по Миколаївській області"
"2024-11-08 23:00:00","30.52355","50.450441","Kyiv","","Відносини Києва та Лондона погіршилися після зміни британського уряду"
"2024-11-09 00:00:00","33.481729","46.55783","Chorna Dolyna","loc","Крупнейший работодатель и налогоплательщик Херсонской области обанкротился из-за войны"
"2024-11-09 00:00:00","34.0994127132379","44.9536335","Simferopol","","Переходная администрация Трампа: Слова Брайана Ланзы о Крыме – не позиция президента"
"2024-11-09 00:00:00","34.0994127132379","44.9536335","Simferopol","","Советник Трампа: Зеленский должен показать реалистичный план завершения войны, без Крыма"
"2024-11-09 00:00:00","37.614779","49.710797","Kupiansk","airstrike|artillery|civcas|loc","РФ ударила авиабомбой по Купянску – два человека погибли, есть пострадавший и разрушения"
"2024-11-09 00:00:00","36.231202","49.992167","Kharkiv","artillery|loc","Россияне ударили по Харькову – предварительно, гибридом ракеты и бомбы ""Гром-1Е"""
"2024-11-09 00:00:00","30.731689","46.484213","Odessa","airstrike|uav|loc","Россияне атаковали Украину 51 дроном, эпицентр – Одесская область"
"2024-11-09 00:00:00","30.731689","46.484213","Odessa","airstrike|uav|aad|loc","обновлено Ночью РФ атаковала Одессу беспилотниками – погиб человек, есть пострадавшие, повреждения"
"2024-11-09 00:00:00","37.275072","47.987693","Kurakhove","loc","""Решающая битва 2024 года"". Почему россияне стремятся окружить ВСУ возле Курахово"
"2024-11-09 00:00:00","34.0994127132379","44.9536335","Simferopol","","Если же тот скажет, что мир наступит только после возвращения Крыма, ""у нас есть новости для президента Зеленского: Крым ушел"", — сказал Ланза."
"2024-11-09 00:00:00","36.231202","49.992167","Kharkiv","loc","Российские войска ударили по Харькову, попав в одну из самых загруженных трасс на пересечении двух районов города, сообщил мэр Игорь Терехов."
"2024-11-09 00:00:00","30.731689","46.484213","Odessa","","Эпицентром удара стала Одесская область."
"2024-11-09 00:00:00","31.767249","47.394622","Kryvorizhzhya","uav|artillery|aad|loc","Также дроны были сбиты в Николаевской, Днепропетровской, Запорожской, Донецкой, Сумской, Харьковской, Полтавской, Винницкой, Черкасской и Тернопольской областях."
"2024-11-09 00:00:00","35.046181","48.464717","Dnipro","uav|artillery|aad|loc","Также дроны были сбиты в Николаевской, Днепропетровской, Запорожской, Донецкой, Сумской, Харьковской, Полтавской, Винницкой, Черкасской и Тернопольской областях."
"2024-11-09 00:00:00","35.767196","47.178945","Vesele","uav|artillery|aad|loc","Также дроны были сбиты в Николаевской, Днепропетровской, Запорожской, Донецкой, Сумской, Харьковской, Полтавской, Винницкой, Черкасской и Тернопольской областях."
"2024-11-09 00:00:00","30.731689","46.484213","Odessa","airstrike|uav|civcas|loc","Через атаку російських дронів в Одесі постраждала школа – ЗМІ."
"2024-11-09 00:00:00","30.731689","46.484213","Odessa","uav|loc","Масована атака російських БпЛА на Одесу: багато пошкоджень, є поранені."
"2024-11-09 00:00:00","36.231202","49.992167","Kharkiv","property|loc","Росіяни атакували Харків КАБ: частково зруйнована багатоповерхівка, 25 постраждалих."
"2024-11-09 00:00:00","37.675289","47.955082","Ruttschenkowo","uav|artillery|aad|loc","Также дроны были сбиты в Николаевской, Днепропетровской, Запорожской, Донецкой, Сумской, Харьковской, Полтавской, Винницкой, Черкасской и Тернопольской областях."
"2024-11-09 00:00:00","30.52355","50.450441","Kyiv","uav|artillery|aad|loc","Ворог атакує ракетами: в Києві та області працює ППО."
"2024-11-09 00:00:00","30.476622","50.023928","Deremezna","civcas|loc","Нічна атака на Київщину: 4 поранених, вирували пожежі, є руйнування."
"2024-11-09 00:00:00","30.405789","46.908223","Bilka","loc","Окупанти атакували Одещину – убили людину і поранили ще 9. США готові підтримати переговори між Україною та Росією, якщо президент Володимир Зеленський висловить готовність до цього."
"2024-11-09 00:00:00","35.138851","47.838312","Zaporizhzhya","civcas|loc","Удар росіян по Запоріжжю: кількість загиблих зросла до 9, серед них – немовля. Засновник групи компаній ""ТАС"" Сергій Тігіпко повідомив про нові напрями бізнесу групи: купівлю насіннєвого заводу та елеватора на 40 тис т зберігання, будівництво заводів з переробки яблук на концентрат і вагонобудівного заводу."
"2024-11-09 00:00:00","35.138851","47.838312","Zaporizhzhya","civcas|loc","В ОВА розповіли про стан поранених у Запоріжжі: 15 госпіталізованих, серед них 5-річна дитина."
"2024-11-09 00:00:00","32.614962","46.640319","Kherson","civcas|loc","Росіяни вбили літнього чоловіка в Херсоні."
"2024-11-09 00:00:00","30.504631","50.473602","Podil","","Одіозний нардеп Шевченко написав листа Трампу і закликав Зеленського до діалогу з РФ. В ОП відреагували."
