"datetime","lon","lat","place_name","event_type","headline"
"2024-11-15 00:00:00","26.411853","50.001433","Bilohirya","airstrike|retreab|loc","Російська авіація завдала авіаударів по Басівці, Журавці, Юнаківці, Великій Писарівці, Одноробівці, Козачій Лопані, Липцях, Піщаному, Ківшарівці, Загризовому, Новоосиновому, Куп'янську, Голубівці, Богуславці, Сергіївці, Іванівці, Новоєгорівці, Ямполівці, Тернах, Сіверську, Званівці, Миколаївці., Часів Яр, Краматорськ, Дачне, Катеринівка, Торецьк, Петрівка, Костянтинівка, Пушкіне, Суха Балка, Мирноград, Шевченка, Курахове, Велика Новосілка, Білогір'я, Зелене Поле, Новопіль, Наталівка, Запоріжжя, Козацьке, - Генштаб ЗСУ с. Україна повідомляє"
"2024-11-15 00:00:00","37.6936803554307","48.5346748","Kostiantynivka","airstrike|retreab|loc","Російська авіація завдала авіаударів по Басівці, Журавці, Юнаківці, Великій Писарівці, Одноробівці, Козачій Лопані, Липцях, Піщаному, Ківшарівці, Загризовому, Новоосиновому, Куп'янську, Голубівці, Богуславці, Сергіївці, Іванівці, Новоєгорівці, Ямполівці, Тернах, Сіверську, Званівці, Миколаївці., Часів Яр, Краматорськ, Дачне, Катеринівка, Торецьк, Петрівка, Костянтинівка, Пушкіне, Суха Балка, Мирноград, Шевченка, Курахове, Велика Новосілка, Білогір'я, Зелене Поле, Новопіль, Наталівка, Запоріжжя, Козацьке, - Генштаб ЗСУ с. Україна повідомляє"
"2024-11-15 00:00:00","35.59462","49.393553","Petrivka","airstrike|retreab|loc","Російська авіація завдала авіаударів по Басівці, Журавці, Юнаківці, Великій Писарівці, Одноробівці, Козачій Лопані, Липцях, Піщаному, Ківшарівці, Загризовому, Новоосиновому, Куп'янську, Голубівці, Богуславці, Сергіївці, Іванівці, Новоєгорівці, Ямполівці, Тернах, Сіверську, Званівці, Миколаївці., Часів Яр, Краматорськ, Дачне, Катеринівка, Торецьк, Петрівка, Костянтинівка, Пушкіне, Суха Балка, Мирноград, Шевченка, Курахове, Велика Новосілка, Білогір'я, Зелене Поле, Новопіль, Наталівка, Запоріжжя, Козацьке, - Генштаб ЗСУ с. Україна повідомляє"
"2024-11-15 00:00:00","37.845879","48.395895","Toretsk","airstrike|retreab|loc","Російська авіація завдала авіаударів по Басівці, Журавці, Юнаківці, Великій Писарівці, Одноробівці, Козачій Лопані, Липцях, Піщаному, Ківшарівці, Загризовому, Новоосиновому, Куп'янську, Голубівці, Богуславці, Сергіївці, Іванівці, Новоєгорівці, Ямполівці, Тернах, Сіверську, Званівці, Миколаївці., Часів Яр, Краматорськ, Дачне, Катеринівка, Торецьк, Петрівка, Костянтинівка, Пушкіне, Суха Балка, Мирноград, Шевченка, Курахове, Велика Новосілка, Білогір'я, Зелене Поле, Новопіль, Наталівка, Запоріжжя, Козацьке, - Генштаб ЗСУ с. Україна повідомляє"
"2024-11-15 00:00:00","37.584398","48.738984","Sotsmisto","airstrike|retreab|loc","Російська авіація завдала авіаударів по Басівці, Журавці, Юнаківці, Великій Писарівці, Одноробівці, Козачій Лопані, Липцях, Піщаному, Ківшарівці, Загризовому, Новоосиновому, Куп'янську, Голубівці, Богуславці, Сергіївці, Іванівці, Новоєгорівці, Ямполівці, Тернах, Сіверську, Званівці, Миколаївці., Часів Яр, Краматорськ, Дачне, Катеринівка, Торецьк, Петрівка, Костянтинівка, Пушкіне, Суха Балка, Мирноград, Шевченка, Курахове, Велика Новосілка, Білогір'я, Зелене Поле, Новопіль, Наталівка, Запоріжжя, Козацьке, - Генштаб ЗСУ с. Україна повідомляє"
"2024-11-15 00:00:00","30.069909","50.306401","Novosilky","loc","Обов'язкову евакуацію сімей з дітьми оголошено у Волноваському районі (в околицях Великої Новосілки), населених пунктах, що підлягають евакуації: Велика Новосілка, Андріївка, Багатир, Времівка, Зелений Кут, Золота Нива, Костянтинопіль, Новий Комар, Новоукраїнка, Одрадне, Олексіївка, Петропавлівка, Розлив., Слов'янка, Улакли, Шевченкове"
"2024-11-15 00:00:00","36.7491672747285","49.49293465","Mar’yevka","loc","Обов'язкову евакуацію сімей з дітьми оголошено у Волноваському районі (в околицях Великої Новосілки), населених пунктах, що підлягають евакуації: Велика Новосілка, Андріївка, Багатир, Времівка, Зелений Кут, Золота Нива, Костянтинопіль, Новий Комар, Новоукраїнка, Одрадне, Олексіївка, Петропавлівка, Розлив., Слов'янка, Улакли, Шевченкове"
"2024-11-15 00:00:00","31.526941","48.315542","Novoukrayinka","loc","Обов'язкову евакуацію сімей з дітьми оголошено у Волноваському районі (в околицях Великої Новосілки), населених пунктах, що підлягають евакуації: Велика Новосілка, Андріївка, Багатир, Времівка, Зелений Кут, Золота Нива, Костянтинопіль, Новий Комар, Новоукраїнка, Одрадне, Олексіївка, Петропавлівка, Розлив., Слов'янка, Улакли, Шевченкове"
"2024-11-15 00:00:00","31.045058","50.645693","Shevchenkove","loc","Обов'язкову евакуацію сімей з дітьми оголошено у Волноваському районі (в околицях Великої Новосілки), населених пунктах, що підлягають евакуації: Велика Новосілка, Андріївка, Багатир, Времівка, Зелений Кут, Золота Нива, Костянтинопіль, Новий Комар, Новоукраїнка, Одрадне, Олексіївка, Петропавлівка, Розлив., Слов'янка, Улакли, Шевченкове"
"2024-11-15 00:00:00","37.675289","47.955082","Ruttschenkowo","loc","Росіяни окупували Рівнопіль на Донеччині – DeepState."
"2024-11-15 00:00:00","30.731689","46.484213","Odessa","airstrike|civcas|loc","Ворожа атака на Одесу: кількість поранених зросла до 10, серед яких двоє дітей."
"2024-11-15 00:00:00","37.675289","47.955082","Ruttschenkowo","loc","Росіяни завдали ударів по Краматорському району на Донеччині – ЗМІ."
"2024-11-15 00:00:00","37.13362","48.06833","Slovianka","loc","Обов'язкову евакуацію сімей з дітьми оголошено у Волноваському районі (в околицях Великої Новосілки), населених пунктах, що підлягають евакуації: Велика Новосілка, Андріївка, Багатир, Времівка, Зелений Кут, Золота Нива, Костянтинопіль, Новий Комар, Новоукраїнка, Одрадне, Олексіївка, Петропавлівка, Розлив., Слов'янка, Улакли, Шевченкове"
"2024-11-15 00:00:00","33.20068","50.19097","Zhdany","uav|aad|loc","Українська ППО за ніч збила 21 з 59 ударних безпілотників"
"2024-11-15 00:00:00","35.80444","47.55413","Preobrazhenka","airstrike|artillery|loc","Російська авіація запускає плануючі бомби в бік Оріхова Запорізької області"
"2024-11-15 00:00:00","36.231202","49.992167","Kharkiv","airstrike|uav|loc","РФ тестирует новые дроны на Харькове, оккупанты ударили по Одессе – LIVE"
"2024-11-15 00:00:00","30.731689","46.484213","Odessa","airstrike|uav|loc","РФ тестирует новые дроны на Харькове, оккупанты ударили по Одессе – LIVE"
"2024-11-15 00:00:00","30.7406","46.39809","Deribasovka","civcas|loc","1 людина загинула, 2 поранені внаслідок російського удару в Одесі"
"2024-11-15 00:00:00","30.74764","46.47094","Odessa","property|loc","В Одесі російська армія влучила у житловий будинок"
"2024-11-15 00:00:00","30.731689","46.484213","Odessa","artillery|ied|property|loc","В Одесі прогриміли вибухи. По місту було випущено 2 ракети Х-59/69"
"2024-11-15 00:00:00","35.138851","47.838312","Zaporizhzhya","airstrike|artillery|loc","Російська авіація запускає плануючі бомби в бік Оріхова Запорізької області"
"2024-11-15 00:00:00","37.96772","49.10747","Terny","civcas|loc","У селищі Терни Донецької області російські війська розстріляли мирну жінку"
"2024-11-15 00:00:00","33.6834","49.95161","Leshchenky","uav|property|loc","У Полтавській області вогнеборці ліквідували пожежу на об'єкті промислової інфраструктури, спричинену ударом безпілотника"
"2024-11-15 00:00:00","37.25876","48.05948","Voznesenka","control|occupy|loc","Міністерство оборони Росії заявляє про повну окупацію селища Вознесенка Донецької області України"
"2024-11-15 00:00:00","37.96618","49.09162","Terny","firefighb|loc","На Лиманському напрямку вчора відбулися бої біля Чернещини, Зарічного, Новоєгорівки та Тернів, - повідомляє Генштаб ЗСУ"
"2024-11-15 00:00:00","37.82648","48.35216","Nelipivka","firefighb|raid|loc","На Торецькому напрямку вчора відбулися бойові зіткнення під Торецьком і Нелипівкою, - повідомляє Генштаб ЗСУ"
"2024-11-15 00:00:00","30.731689","46.484213","Odessa","civcas|loc","Атака на Одессу: известно уже о восьми раненых, среди них девятилетний мальчик"
"2024-11-15 00:00:00","38.221114","49.049943","Kreminna","loc","На Курахівському напрямку бойові дії вчора відбулися поблизу Берестків, Іллінки, Новоселидівки, Сонцівки, Кремінної Балки, Вознесенки, Новодмитрівки, Максимілянівки, Дальнього, Антонівки та Катеринівки, - повідомляє Генштаб ЗСУ."
"2024-11-15 00:00:00","37.3312","47.8788","Katerynivka","loc","На Курахівському напрямку бойові дії вчора відбулися поблизу Берестків, Іллінки, Новоселидівки, Сонцівки, Кремінної Балки, Вознесенки, Новодмитрівки, Максимілянівки, Дальнього, Антонівки та Катеринівки, - повідомляє Генштаб ЗСУ."
"2024-11-15 00:00:00","35.59462","49.393553","Petrivka","loc","На Покровському напрямку бойові дії вчора відбулися поблизу Сухої Балки, Проміні, Лисівки, Крутого Яру, Григорівки, Даченського, Миролюбівки, Петрівки, Новоолексіївки, Пустинки, - повідомляє Генштаб ЗСУ."
"2024-11-15 00:00:00","33.847145","47.835445","Novooleksiivka","loc","На Покровському напрямку бойові дії вчора відбулися поблизу Сухої Балки, Проміні, Лисівки, Крутого Яру, Григорівки, Даченського, Миролюбівки, Петрівки, Новоолексіївки, Пустинки, - повідомляє Генштаб ЗСУ."
"2024-11-15 00:00:00","37.84309","48.55251","Pivdennyi","firefighb|loc","На Краматорському напрямку вчора відбулися бої під Ступочками, - повідомляє Генштаб ЗСУ"
"2024-11-15 00:00:00","36.80969","47.77335","Makarivka","firefighb|loc","На Времівському напрямку вчора відбулися бої біля Рівнополя, Новополя, Трудового, Костянтинопольського та Макарівки, - повідомляє Генштаб ЗСУ"
"2024-11-15 00:00:00","35.69578","47.55578","Novoandriivka","raid|occupy|loc","На Оріхівському напрямку вчора відбулися бойові зіткнення поблизу Новоданилівки та Новоандріївки, - повідомляє Генштаб ЗСУ"
"2024-11-15 00:00:00","36.93655","50.29734","Vovchansk","firefighb|raid|loc","На харківському напрямку вчора відбулися бойові зіткнення під Вовчанськом і Високою Яругою, - повідомляє Генштаб ЗСУ"
"2024-11-15 00:00:00","35.34817","47.8371","Natalivka","airstrike|retreab|loc","Російська авіація завдала авіаударів по Басівці, Журавці, Юнаківці, Великій Писарівці, Одноробівці, Козачій Лопані, Липцях, Піщаному, Ківшарівці, Загризовому, Новоосиновому, Куп'янську, Голубівці, Богуславці, Сергіївці, Іванівці, Новоєгорівці, Ямполівці, Тернах, Сіверську, Званівці, Миколаївці., Часів Яр, Краматорськ, Дачне, Катеринівка, Торецьк, Петрівка, Костянтинівка, Пушкіне, Суха Балка, Мирноград, Шевченка, Курахове, Велика Новосілка, Білогір'я, Зелене Поле, Новопіль, Наталівка, Запоріжжя, Козацьке, - Генштаб ЗСУ с. Україна повідомляє"
"2024-11-15 00:00:00","37.187","48.15725","Pustynka","loc","На Покровському напрямку бойові дії вчора відбулися поблизу Сухої Балки, Проміні, Лисівки, Крутого Яру, Григорівки, Даченського, Миролюбівки, Петрівки, Новоолексіївки, Пустинки, - повідомляє Генштаб ЗСУ."
"2024-11-15 00:00:00","39.348779","48.699789","Pankivka","airstrike|retreab|loc","Російська авіація завдала авіаударів по Басівці, Журавці, Юнаківці, Великій Писарівці, Одноробівці, Козачій Лопані, Липцях, Піщаному, Ківшарівці, Загризовому, Новоосиновому, Куп'янську, Голубівці, Богуславці, Сергіївці, Іванівці, Новоєгорівці, Ямполівці, Тернах, Сіверську, Званівці, Миколаївці., Часів Яр, Краматорськ, Дачне, Катеринівка, Торецьк, Петрівка, Костянтинівка, Пушкіне, Суха Балка, Мирноград, Шевченка, Курахове, Велика Новосілка, Білогір'я, Зелене Поле, Новопіль, Наталівка, Запоріжжя, Козацьке, - Генштаб ЗСУ с. Україна повідомляє"
"2024-11-15 00:56:00","30.731689","46.484213","Odessa","property|civcas|loc","Серед постраждалих в Одесі 9-річна дитина, зруйновано багатоповерховий будинок у центрі - Кіпер"
"2024-11-15 01:06:00","30.731689","46.484213","Odessa","uav|loc","Одеса була під масованою атакою РФ: є жертва та проблеми з теплопостачанням в місті (фото)"
"2024-11-15 01:06:00","37.275072","47.987693","Kurakhove","loc","Мета РФ - захопити Старі Терни у максимально короткі терміни: DeepState про ситуацію біля Курахового"
"2024-11-15 02:31:00","33.5229142","44.6010512","Sevastopol","loc","Росіяни збираються повернути Чорноморський флот у Севастополь"
"2024-11-15 03:37:00","30.731689","46.484213","Odessa","uav|civcas|loc","Росія запустила БПЛА по території України: в Одесі загинула жінка, серед поранених - 9-річний хлопчик"
"2024-11-15 04:44:00","35.046181","48.464717","Dnipro","loc","DeepState: Росія окупувала Рівнопіль - населений пункт у 10 км від Дніпропетровщини"
"2024-11-15 06:57:00","30.731689","46.484213","Odessa","airstrike|uav|civcas|loc","Уже десять постраждалих унаслідок ворожої атаки Одеси"
"2024-11-15 07:21:00","35.138851","47.838312","Zaporizhzhya","artillery|loc","Росіяни обстріляли 12 населених пунктів Запорізької області"
"2024-11-15 07:25:00","35.138851","47.838312","Zaporizhzhya","cyber","Українські хакери зламали комп'ютер екскомандувача силами РФ на Запорізькому напрямі: що цікавого знайшли"
"2024-11-15 08:00:00","30.52355","50.450441","Kyiv","control|loc","""Тепер вони здатні воювати"": бригада ""Анна Київська"" їде на фронт у критичний момент війни"
"2024-11-15 08:04:00","34.0994127132379","44.9536335","Simferopol","uav|aad|loc","БПЛА атакували об'єкти РФ на Білгородщині, в Краснодарському краї, окупованих Криму, Бердянську та Маріуполі"
"2024-11-15 08:04:00","36.789317","46.755673","Berdyansk","uav|aad|loc","БПЛА атакували об'єкти РФ на Білгородщині, в Краснодарському краї, окупованих Криму, Бердянську та Маріуполі"
"2024-11-15 08:04:00","37.54144","47.096703","Mariupol","uav|aad|loc","БПЛА атакували об'єкти РФ на Білгородщині, в Краснодарському краї, окупованих Криму, Бердянську та Маріуполі"
"2024-11-15 08:08:00","37.834354","48.587665","Levanivskoho","loc","У Часовому Ярі ситуація критична, в місті залишається трохи більше 300 людей"
"2024-11-15 08:18:00","33.481729","46.55783","Chorna Dolyna","artillery|civcas|loc","Унаслідок російських обстрілів Херсонщини п’ятеро поранених"
"2024-11-15 08:27:00","30.731689","46.484213","Odessa","loc","Ремонтні роботи котельні в Одесі після ворожої атаки завершено, жителям скоро відновлять теплопостачання"
"2024-11-15 08:37:00","37.275072","47.987693","Kurakhove","loc","Минулої доби на фронті сталось 144 боєзіткнення: окупанти найактивніші на Курахівському напрямку"
"2024-11-15 09:56:00","30.731689","46.484213","Odessa","uav|loc","Одеса зазнала масованої комбінованої атаки: жахливі наслідки ударів (фото)"
"2024-11-15 10:27:00","30.52355","50.450441","Kyiv","","До Києва прибув заступник держсекретаря США з управління та ресурсів"
"2024-11-15 10:37:00","30.52355","50.450441","Kyiv","","Заступник держсекретаря США Річард Верма прибув до Києва"
"2024-11-15 11:09:00","30.731689","46.484213","Odessa","civcas|loc","Росія завдала комбінованого масованого удару по Одесі: загинула жінка, серед поранених - 9-річний хлопчик"
"2024-11-15 11:17:00","30.52355","50.450441","Kyiv","","У Франції завершують підготовку бійці української бригади ""Анна Київська"""
"2024-11-15 11:31:00","30.731689","46.484213","Odessa","property|loc","В Одесі пошкоджена будівля сімейної амбулаторії - пам'ятка архітектури"
"2024-11-15 12:19:00","30.52355","50.450441","Kyiv","loc","Франція завершує тренування бригади ""Анна Київська"", яка посилить оборону України на фронті"
"2024-11-15 12:49:00","30.731689","46.484213","Odessa","artillery|property|loc","Унаслідок ворожого обстрілу Одеси пошкоджені дві школи і три дитсадки"
"2024-11-15 13:14:00","23.413124","48.220758","Posich","artillery|property|loc","На Закарпатті чоловік стріляв біля будівлі ТЦК: чого він домагався (відео)"
"2024-11-15 13:15:00","32.004063","51.355426","Volovytsia","loc","У селі на Чернігівщині ""засвітився"" прапор РФ: в ДПСУ пояснили ситуацію"
"2024-11-15 13:17:00","33.481729","46.55783","Chorna Dolyna","civcas|loc","В Антонівці на Херсонщині через атаку РФ загинула жінка"
"2024-11-15 13:18:00","30.52355","50.450441","Kyiv","","У Києві ""таємно"" радіють, що Трамп може закінчити війну, - Politico"
"2024-11-15 13:24:00","32.004063","51.355426","Volovytsia","raid|loc","Сили оборони спростували заяви російських пропагандистів про захід ворожої ДРГ до с.Грем'яч на Чернігівщині"
"2024-11-15 13:24:00","33.288492","52.340606","Hremiach","raid|loc","Сили оборони спростували заяви російських пропагандистів про захід ворожої ДРГ до с.Грем'яч на Чернігівщині"
"2024-11-15 13:33:00","37.845879","48.395895","Toretsk","firefighb|loc","У Торецьку тривають міські бої, на сіверському напрямку окупанти стягують резерви - речниця ОТУ ""Луганськ"""
"2024-11-15 13:33:00","39.307708","48.573896","Luhansk","firefighb|loc","У Торецьку тривають міські бої, на сіверському напрямку окупанти стягують резерви - речниця ОТУ ""Луганськ"""
"2024-11-15 13:43:00","31.352326","49.26","Petropavlivka","arresb|loc","Суд заарештував начальника колонії на Черкащині та учасників організованої ""сходки"""
