"datetime","lon","lat","place_name","event_type","headline"
"2024-11-22 03:34:00","37.675289","47.955082","Ruttschenkowo","uav","Партизани допомогли знищити російський підрозділ БПЛА на Донеччині"
"2024-11-22 06:42:00","35.046181","48.464717","Dnipro","","Удар новою балістикою по Дніпру: в ISW проаналізували, як це змінює війну"
"2024-11-22 06:55:00","34.802764","50.91198","Sumy","airstrike|uav|loc","РФ завдала удару ""шахедами"" по житловому мікрорайону Сум"
"2024-11-22 07:31:00","34.802764","50.91198","Sumy","uav|milcas|loc","Росія атакувала Суми ""шахедами"", є загиблі (фото)"
"2024-11-22 07:47:00","35.138851","47.838312","Zaporizhzhya","artillery|loc","Окупанти за добу обстріляли 10 населених пунктів Запорізької області"
"2024-11-22 07:52:00","30.476622","50.023928","Deremezna","airstrike|uav|aad|loc","Росія запустила ""шахеди"": у Сумах є загиблі та постраждалі, на Київщині працювала ППО"
"2024-11-22 08:01:00","32.614962","46.640319","Kherson","artillery|civcas|loc","У Херсонській області один загиблий і двоє поранених через російські обстріли"
"2024-11-22 08:05:00","30.52355","50.450441","Kyiv","loc","П'ятниця в Києві буде холодною, мокрою та похмурою"
"2024-11-22 08:14:00","37.275072","47.987693","Kurakhove","loc","Минулої доби на фронті відбулось 190 бойових зіткнення. Найважча ситуація на Покровському та Курахівському напрямках"
"2024-11-22 08:14:00","37.175601","48.280351","Pokrovsk","loc","Минулої доби на фронті відбулось 190 бойових зіткнення. Найважча ситуація на Покровському та Курахівському напрямках"
"2024-11-22 08:34:00","37.834354","48.587665","Levanivskoho","","У Часовому Ярі з доступу до води лишилась одна свердловина"
"2024-11-22 08:39:00","35.046181","48.464717","Dnipro","","У Дніпрі вируватиме негода: синоптики оголосили попередження (інфографіка)"
"2024-11-22 08:51:00","30.213451","50.553346","Yablon’ki","loc","В Австрії показали фільм ""Буча"" про окупацію Київщини"
"2024-11-22 08:51:00","30.476622","50.023928","Deremezna","loc","В Австрії показали фільм ""Буча"" про окупацію Київщини"
"2024-11-22 08:57:00","30.52355","50.450441","Kyiv","","Глава МЗС Чехії прибув до Києва"
"2024-11-22 09:10:00","30.731689","46.484213","Odessa","","В Одесі та області оголосили І рівень небезпеки (інфографіка)"
"2024-11-22 09:14:00","37.54144","47.096703","Mariupol","uav|aad|property|loc","У Маріуполі спрацювала ворожа ППО, у місті частково зникло електропостачання"
"2024-11-22 09:19:00","34.802764","50.91198","Sumy","airstrike|uav|artillery|civcas|loc","Атака на Суми: росіяни вперше вдарили ""шахедом"" зі шрапнеллю"
"2024-11-22 09:38:00","24.029898","49.839323","Lviv","loc","Зимова негода йде на Львів: синоптики прогнозують хуртовини, ожеледицю та вітер"
"2024-11-22 10:08:00","23.413124","48.220758","Posich","","На Закарпатті викрили схему діагнозів - ""липових"" психрозладів для ухилянтів"
"2024-11-22 10:19:00","30.52355","50.450441","Kyiv","","Київ затвердив рекомендації щодо безпечного використання генераторів"
"2024-11-22 10:46:00","37.275072","47.987693","Kurakhove","arresb|retreab|loc","Окупанти частково захопили Курахове, - аналітик BILD"
"2024-11-22 11:54:00","36.231202","49.992167","Kharkiv","arresb|loc","Верховний суд поставив крапку у справі теракту біля Палацу спорту в Харкові 2015 року"
"2024-11-22 12:15:00","36.682211","46.869295","Roza","","Джек та Роза з ""Титаніка"" возз'єдналися: як змінилися Ді Капріо та Вінслет за 27 років"
"2024-11-22 12:19:00","33.481729","46.55783","Chorna Dolyna","artillery|civcas|loc","Унаслідок ворожого обстрілу поранено жителя Антонівки на Херсонщині"
"2024-11-22 12:24:00","37.584398","48.738984","Sotsmisto","loc","Росіяни атакували передмістя Краматорська: загинула людина, є поранені"
"2024-11-22 12:39:00","22.974979","49.801092","Shegyni","","Польські фермери планують розпочати новий страйк 23 листопада перед ПП ""Медика – Шегині"""
"2024-11-22 13:03:00","35.046181","48.464717","Dnipro","","У ГУР зробили заяву про нову балістику, якою Росія вдарила по Дніпру"
"2024-11-22 13:06:00","30.213451","50.553346","Yablon’ki","","Порошенко прийшов на фільм про закатованих у Бучі в куртці за $6000, це цинізм, - експерт"
"2024-11-22 13:40:00","35.046181","48.464717","Dnipro","airstrike|artillery|property|loc","ГУР заявило: росіяни вдарили по Дніпру балістичною ракетою з комплексу ""Кєдр"""
"2024-11-22 13:40:00","30.52355","50.450441","Kyiv","","Деякі західні чиновники допускають повернення Києву ядерної зброї, США планують переглядати ядерну доктрину"
"2024-11-22 13:48:00","35.046181","48.464717","Dnipro","uav|artillery|loc","У ГУР розповіли про балістичну ракету, якою було атаковано Дніпро"
"2024-11-22 13:53:00","32.614962","46.640319","Kherson","airstrike|artillery|civcas|retreab|loc","Окупанти обстріляли Херсон і область: скинули вибухівку на тролейбус, поранили двох людей"
"2024-11-22 14:01:00","23.413124","48.220758","Posich","loc","Довічний термін отримав депутат, який підірвав гранати під час засідання сільради на Закарпатті"
"2024-11-22 14:26:00","30.52355","50.450441","Kyiv","loc","У Києві відкрили реабілітаційний центр Recovery для військових, поліцейських і рятувальників"
"2024-11-22 14:53:00","23.413124","48.220758","Posich","ied|loc","Депутат, який підірвав гранати у сільраді на Закарпатті, отримав довічне"
"2024-11-22 15:02:00","36.231202","49.992167","Kharkiv","artillery|property|loc","Підприємцю загрожує до восьми років в'язниці за завищення вартості ремонту пошкодженої обстрілами будівлі наукової установи в Харкові – прокуратура"
"2024-11-22 15:06:00","35.046181","48.464717","Dnipro","artillery|loc","""Жахлива ескалація"": Шольц прокоментував удар Росії по Дніпру гіперзвуковою ракетою"
"2024-11-22 15:34:00","36.231202","49.992167","Kharkiv","loc","У Харкові новорічну ялинку міста встановили в метро"
"2024-11-22 15:38:00","30.52355","50.450441","Kyiv","","Ремонт пральних машин у Києві: ціни 2024"
"2024-11-22 16:07:00","36.231202","49.992167","Kharkiv","","ПРООН і Японія передали енергообладнання Харкову й Одесі для підтримки критичної інфраструктури"
"2024-11-22 16:07:00","30.731689","46.484213","Odessa","","ПРООН і Японія передали енергообладнання Харкову й Одесі для підтримки критичної інфраструктури"
"2024-11-22 16:41:00","35.046181","48.464717","Dnipro","artillery|loc","Реакція на удар МБР по Дніпру: скоро відбудеться надзвичайне засідання Ради НАТО - Україна"
"2024-11-22 16:45:00","36.43256","50.216866","Lyptsi","ied|arresb","Затримано псевдомінера, який погрожував підірвати ""Харківобленерго"", якщо не скасують відключення світла"
"2024-11-22 16:49:00","37.275072","47.987693","Kurakhove","control|loc","Окупанти, імовірно, контролюють частину Курахового"
"2024-11-22 16:57:00","35.046181","48.464717","Dnipro","artillery","РФ вже використовувала ракети з подібною вагою бойової частини: Хазан про удар міжконтинентальною балістикою по Дніпру"
"2024-11-22 17:07:00","37.675289","47.955082","Ruttschenkowo","uav","На фронті з опівночі було вже 118 бойових зіткнень, більшість на Донеччині - Генштаб"
"2024-11-22 17:11:00","37.584398","48.738984","Sotsmisto","artillery|civcas|loc","Росіяни обстріляли Краматорськ касетними боєприпасами, одна людина загинула, двоє постраждали - поліція"
"2024-11-22 17:13:00","37.675289","47.955082","Ruttschenkowo","loc","Вихід на кордони Донеччини й Луганщини: в ГУР назвали завдання армії РФ на осінньо-зимовий період"
"2024-11-22 17:13:00","38.902523","49.158739","Baydivka","loc","Вихід на кордони Донеччини й Луганщини: в ГУР назвали завдання армії РФ на осінньо-зимовий період"
"2024-11-22 17:18:00","35.046181","48.464717","Dnipro","artillery|loc","Ракети ""Орєшнік"" не існує: Жданов розповів, чим могла вдарити РФ по Дніпру"
"2024-11-22 17:18:00","37.6058241","48.8522691","Sloviansk","artillery|arresb|loc","Суд призначив 10 років в'язниці поплічнику РФ, який спрямовував російські ракети на артпозиції ЗСУ поблизу Слов'янська - СБУ"
"2024-11-22 17:26:00","35.046181","48.464717","Dnipro","ied|loc","У Дніпровському районі Києва від вибуху загинув чоловік, поліція з'ясовує обставини"
"2024-11-22 17:26:00","30.52355","50.450441","Kyiv","ied|loc","У Дніпровському районі Києва від вибуху загинув чоловік, поліція з'ясовує обставини"
"2024-11-22 17:43:00","30.52355","50.450441","Kyiv","loc","У Київському авіаційному інституті буде створено Huawei Excellence Center"
"2024-11-22 17:46:00","30.52355","50.450441","Kyiv","uav|aad|airalerb|loc","ППО Києва посилено - джерело"
"2024-11-22 17:47:00","30.52355","50.450441","Kyiv","","""Нова бравада Кремля"": Москва прагне залякати Київ і союзників, - The Washington Post"
"2024-11-22 17:54:00","37.248203","47.779055","Vuhledar","arresb|loc","Росіяни розстріляли 5 полонених бійців ЗСУ поблизу Вугледара - прокуратура"
"2024-11-22 18:00:00","31.041204","51.306257","Kozerohy","","Гороскоп на 23 листопада за картами Таро: Ракам - сумніви, Козерогам - спокуси"
"2024-11-22 18:00:00","30.476622","50.023928","Deremezna","airalerb|loc","Повітряна тривога на Київщині тривала понад 10 годин, ворожі цілі знищено - обладміністрація"
"2024-11-22 18:00:00","35.046181","48.464717","Dnipro","","Від ""Черемухи"" на Майдані до ""Орєшніка"" в Дніпрі"
"2024-11-22 18:14:00","37.248203","47.779055","Vuhledar","arresb|loc","Росіяни розстріляли 5 полонених воїнів ЗСУ поблизу Вугледара"
"2024-11-22 18:48:00","37.275072","47.987693","Kurakhove","airstrike|uav|loc","Росіяни ""стирають в нуль"" Курахове: опубліковано відео прильоту авіабомби в ТЕС"
"2024-11-22 18:52:00","35.138851","47.838312","Zaporizhzhya","loc","Курська операція ЗСУ зірвала Росії плани наступу на Запоріжжя, - ЗМІ"
"2024-11-22 19:00:00","30.476622","50.023928","Deremezna","uav|aad|loc","Росія атакувала Україну ""шахедами"": у Сумах є загиблі та постраждалі, на Київщині працювала ППО"
"2024-11-22 19:50:00","30.476622","50.023928","Deremezna","loc","Поліцейські викрили чиновницю МСЕК на Київщині, яка допомагала військовозобов'язаним отримати групу інвалідності"
"2024-11-22 20:39:00","36.231202","49.992167","Kharkiv","raid|loc","Готуються до штурмів: війська КНДР вже у Маріуполі і під Харковом, - CNN"
"2024-11-22 20:39:00","37.54144","47.096703","Mariupol","raid|loc","Готуються до штурмів: війська КНДР вже у Маріуполі і під Харковом, - CNN"
"2024-11-22 20:50:00","37.675289","47.955082","Ruttschenkowo","airstrike|uav|loc","Нові подробиці щодо удару по Дніпру та чим зумовлене просування росіян на Донеччині. Колонка Сергія Згурця"
"2024-11-22 20:50:00","35.046181","48.464717","Dnipro","airstrike|uav|loc","Нові подробиці щодо удару по Дніпру та чим зумовлене просування росіян на Донеччині. Колонка Сергія Згурця"
"2024-11-22 21:33:00","30.52355","50.450441","Kyiv","airalerb|loc","У трьох районах Києва тимчасово не працює повітряна тривога"
"2024-11-22 21:53:00","35.046181","48.464717","Dnipro","airstrike|loc","Чому Росія вдарила МБР по Дніпру, а не Києву: експерт назвав причину"
"2024-11-22 21:53:00","30.52355","50.450441","Kyiv","airstrike|loc","Чому Росія вдарила МБР по Дніпру, а не Києву: експерт назвав причину"
"2024-11-22 22:17:00","36.505117","49.61494","Slobozhans’ke","loc","ЗСУ відреагували на заяву про війська КНДР на Харківщині"
"2024-11-22 22:23:00","36.231202","49.992167","Kharkiv","control|loc","В ОТУ ""Харків"" заперечили, що на Харківському напрямку помітили північнокорейських військових"
"2024-11-22 22:34:00","36.505117","49.61494","Slobozhans’ke","loc","ЗСУ спростовує інформацію про присутність військових КНДР на Харківщині"
"2024-11-22 22:45:00","24.029898","49.839323","Lviv","artillery|loc","На Львівському залізничному вокзалі звучав унікальний орган із фрагментами розірваних російських ракет"
"2024-11-22 22:50:00","36.7491672747285","49.49293465","Mar’yevka","loc","Росіяни мають значне просування на відтинку Кліщіївка - Андріївка"
"2024-11-22 22:52:00","30.52355","50.450441","Kyiv","","Корнієнко привітав главу МЗС Чехії, який прибув до Києва"
"2024-11-22 23:03:00","35.138851","47.838312","Zaporizhzhya","airstrike|property|loc","Росіяни вдарили по Запорізькій області, є руйнування"
"2024-11-22 23:11:00","35.138851","47.838312","Zaporizhzhya","artillery|property|loc","РФ обстріляла Запоріжжя та область: пошкоджено будинки, ферму та склади"
"2024-11-22 23:21:00","30.52355","50.450441","Kyiv","","Оборонна співпраця й посилення санкційного тиску на РФ: Сибіга і Шмигаль зустрілися в Києві з очільником МЗС Чехії Ліпавським"
"2024-11-22 23:39:00","37.175601","48.280351","Pokrovsk","artillery|loc","Росіяни найактивніше атакують на Покровському й Курахівському напрямках, на Курщині українські бійці тримають оборону"
"2024-11-22 23:39:00","37.275072","47.987693","Kurakhove","artillery|loc","Росіяни найактивніше атакують на Покровському й Курахівському напрямках, на Курщині українські бійці тримають оборону"
"2024-11-23 00:00:00","35.046181","48.464717","Dnipro","artillery|loc","""Кедровий Орєшнік"": Буданов пояснив особливості експериментальної ракети, що прилетіла по Дніпру."
"2024-11-23 00:00:00","23.413124","48.220758","Posich","ied|loc","Довічний термін отримав депутат, який підірвав три гранати у сільраді на Закарпатті."
"2024-11-23 00:00:00","36.231202","49.992167","Kharkiv","loc","У Харкові на станції метро встановили головну ялинку."
"2024-11-23 00:00:00","32.82745","46.790261","Inhulets","","""Чорноморець"" для ""Динамо"", ""Інгулець"" для ""Шахтаря"". Прев'ю 14 туру УПЛ."
"2024-11-23 00:00:00","35.046181","48.464717","Dnipro","airstrike|property|loc","Росіяни атакували Дніпро: пошкоджена інфраструктура."
"2024-11-23 00:00:00","37.584398","48.738984","Sotsmisto","civcas|loc","Росіяни атакували селище у передмісті Краматорська: один загиблий, двоє поранених."
"2024-11-23 00:00:00","30.52355","50.450441","Kyiv","","""Сокіл"" здолав ""Київ Кепіталз"" у столичному дербі в чемпіонаті України."
"2024-11-23 00:00:00","35.046181","48.464717","Dnipro","uav|loc","""Кедр"": ГУР оприлюднило деталі про нову балістику, якою РФ вдарила по Дніпру 21 листопада."
"2024-11-23 00:00:00","30.52355","50.450441","Kyiv","loc","У Києві винесли вирок жінці, яка викинула з вікна свого 18-річного кота."
"2024-11-23 00:00:00","34.0994127132379","44.9536335","Simferopol","arresb|loc","У Криму викрали редакторку кримськотатарського дитячого журналу Едіє Муслімову."
"2024-11-23 00:00:00","30.731689","46.484213","Odessa","","Японія передала енергообладнання Харкову й Одесі: суттєво підтримає критичну інфраструктуру."
"2024-11-23 00:00:00","36.231202","49.992167","Kharkiv","","Японія передала енергообладнання Харкову й Одесі: суттєво підтримає критичну інфраструктуру."
"2024-11-23 00:00:00","37.675289","47.955082","Ruttschenkowo","loc","Частині Донеччини скоротили подачу води."
"2024-11-23 00:00:00","30.476622","50.023928","Deremezna","airalerb|loc","На Київщині повітряна тривога тривала більше 10 годин."
"2024-11-23 00:00:00","35.046181","48.464717","Dnipro","","Рада Україна-НАТО скликає позачергову зустріч через атаку РФ на Дніпро експериментальною ракетою."
"2024-11-23 00:00:00","30.52355","50.450441","Kyiv","ied|loc","У Києві в руках у чоловіка вибухнула коробка, він загинув на місці."
"2024-11-23 00:00:00","30.52355","50.450441","Kyiv","airalerb|loc","У трьох районах Києва тимчасово не працює сигнал повітряної тривоги."
"2024-11-23 00:00:00","23.916737","49.717495","Pustomyty","","Львівська ""Енергія"" здолала ""Суху Балку"" в стартовому матчі 6 туру чемпіонату України."
"2024-11-23 00:00:00","35.138851","47.838312","Zaporizhzhya","property|loc","Росіяни вдарили по Запоріжжю та області."
"2024-11-23 00:00:00","37.248203","47.779055","Vuhledar","artillery|loc","Росіяни розстріляли п’ятьох полонених бійців ЗСУ біля Вугледара."
"2024-11-23 00:00:00","23.413124","48.220758","Posich","loc","Медики й посадовці ТЦК на Закарпатті організували схему ухилення від мобілізації."
"2024-11-23 00:00:00","37.675289","47.955082","Ruttschenkowo","","DeepState: Російські війська мають просування поблизу пʼяти населених пунктів Донеччини."
"2024-11-23 00:00:00","35.046181","48.464717","Dnipro","uav|artillery","CNN оприлюднив фото уламків нової ракети РФ, яка могла атакувати Дніпро 21 листопада."
"2024-11-23 00:00:00","36.231202","49.992167","Kharkiv","","Без Пушкина: в Харькове переименовали театр в честь украинского писателя"
"2024-11-23 00:00:00","33.481729","46.55783","Chorna Dolyna","airstrike|loc","Росіяни атакували житлові квартали Херсонщини – п’ятеро поранених."
"2024-11-23 00:00:00","36.789317","46.755673","Berdyansk","uav|ied|loc","У Бердянську в районі порту пролунав вибух."
"2024-11-23 00:00:00","23.413124","48.220758","Posich","loc","Електропотяг зійшов з рейок через падіння каміння на Закарпатті."
"2024-11-23 00:00:00","22.974979","49.801092","Shegyni","","Поляки почали страйк перед пунктом пропуску ""Медика - Шегині""."
"2024-11-23 00:00:00","34.0994127132379","44.9536335","Simferopol","","ФСБ у Криму півтори доби утримувала головредку кримськотатарського дитячого журналу."
"2024-11-23 00:00:00","35.046181","48.464717","Dnipro","artillery|ied|property|retreab|loc","Нова ракета, якою РФ вдарила по Дніпру, не мала вибухівки та не спричинила руйнувань - BILD."
"2024-11-23 00:00:00","30.52355","50.450441","Kyiv","loc","Знущався з дружини і виганяв з дому: у Києві чоловіка покарали за домашнє насильство."
"2024-11-23 00:00:00","33.778487","49.732386","Luhove","loc","Полтавська ""Ворскла"" вдома обіграла черкаський ЛНЗ у чемпіонаті України з футболу."
"2024-11-23 00:00:00","34.802764","50.91198","Sumy","uav|artillery","Застосовується для знищення людей: Суми атакували ""Шахеди"", споряджені шрапнеллю. Ціни на нафту продовжили зростання в п'ятницю, прямуючи до тижневого зростання більш ніж на 4%, оскільки війна в Україні посилилася, а Володимир Путін попередив про глобальний конфлікт."
"2024-11-23 00:00:00","35.046181","48.464717","Dnipro","loc","""Кременчук"" здолав одеський ""Шторм"", херсонський ""Дніпро"" здобув перше перемогу в чемпіонаті України."
"2024-11-23 00:00:00","30.52355","50.450441","Kyiv","civcas|loc","У готелі Києва сталася стрілянина: є загиблий і поранені, нападника шукають."
